{
  "nombre_negocio": "Cafeteria ñoñoa",
  "rubro": "Cafetería",
  "ciudad": "Santiago",
  "telefono": "+56 9 8765 4323",
  "email": "contacto@cafeteriañoñoa.cl",
  "direccion": "Av. Irarrázaval 456, Ñoñoa, Santiago",
  "slogan": "La cafetería geek de ñuñoa",
  "descripcion": "Somos la cafetería geek de ñuñoa, ambientada completamente con lo mejor del mundo anime y gamer. Atendemos de lunes a viernes de 8:00 a 18:00.",
  "servicio_1_titulo": "Cafés y bebidas",
  "servicio_1_desc": "Cafés, Jugos naturales, cócteles, smoothies, etc.",
  "servicio_1_icono": "☕",
  "servicio_2_titulo": "Comida",
  "servicio_2_desc": "Hamburguesas, pizzas, ensaladas, etc.",
  "servicio_2_icono": "🍔",
  "servicio_3_titulo": "Postres",
  "servicio_3_desc": "Helados, pasteles, etc.",
  "servicio_3_icono": "�",
  "color_primario": "#3B82F6",
  "color_secundario": "#2563EB",
  "color_acento": "#60A5FA",
  "hero_variante": "C",
  "servicios_variante": "C",
  "testimonios_variante": "C",
  "nosotros_variante": "C",
  "cta_variante": "C",
  "contacto_variante": "C",
  "og_image_url": "https://quolab.pages.dev/demo-cafeteriañoñoa/og.jpg",
  "demo_url": "https://quolab.pages.dev/demo-cafeteriañoñoa"
}
